TICKER,sector,fullTimeEmployees,longBusinessSummary,city,country,industry,ebitdaMargins,profitMargins,grossMargins,operatingCashflow,revenueGrowth,operatingMargins,ebitda,grossProfits,currentPrice,earningsGrowth,currentRatio,returnOnAssets,debtToEquity,returnOnEquity,totalCash,totalDebt,totalRevenue,quickRatio,longName,bookValue,averageVolume,volume,fiftyTwoWeekHigh,regularMarketPrice,marketCap
WDAY,Technology,15200.0,"Workday, Inc. provides enterprise cloud applications worldwide. Its applications help its customers to plan, execute, analyze, and extend to other applications and environments, and to manage their business and operations. The company offers a suite of financial management applications, which enable chief financial officers to maintain accounting information in the general ledger; manage financial processes; identify real-time financial, operational, and management insights; enhance financial consolidation; reduce time-to-close; promote internal control and auditability; and achieve consistency across finance operations. It also provides cloud spend management solutions that helps organizations to streamline supplier selection and contracts, manage indirect spend, and build and execute sourcing events, such as requests for proposals; Human Capital Management (HCM) solution, a suite of human capital management applications that allows organizations to manage the entire employee lifecycle from recruitment to retirement, and enables HR teams to hire, onboard, pay, develop, reskill, and provide employee experiences; Workday applications for planning; and applications for analytics and reporting, including augmented analytics to surface insights to the line of business in simple-to-understand stories, machine learning to drive efficiency and automation, and benchmarks to compare performance against other companies. It serves professional and business services, financial services, healthcare, education, government, technology, media, retail, and hospitality industries. The company was formerly known as North Tahoe Power Tools, Inc. and changed its name to Workday, Inc. in July 2005. Workday, Inc. was incorporated in 2005 and is headquartered in Pleasanton, California.",Pleasanton,United States,Software—Application,0.04423,0.0057200002,0.7221,1650704000.0,0.216,-0.02266,227272992.0,3710703000.0,243.6,,1.029,-0.0075700004,46.366,0.0075199995,3644161024.0,2102755968.0,5138798080.0,0.964,"Workday, Inc.",18.068,2301680.0,2750282.0,307.81,243.6,58443780096.0
PANW,Technology,11527.0,"Palo Alto Networks, Inc. provides cybersecurity solutions worldwide. The company offers firewall appliances and software; Panorama, a security management solution for the control of firewall appliances and software deployed on an end-customer's network and instances in public or private cloud environments, as a virtual or a physical appliance; and virtual system upgrades, which are available as extensions to the virtual system capacity that ships with physical appliances. It also provides subscription services covering the areas of threat prevention, malware and persistent threat, uniform resource locator filtering, laptop and mobile device protection, and firewall; and DNS security, Internet of Things security, SaaS security API, and SaaS security inline, as well as threat intelligence, and data loss prevention. In addition, the company offers cloud security, secure access, security analytics and automation, and threat intelligence and cyber security consulting; professional services, including architecture design and planning, implementation, configuration, and firewall migration; education services, such as certifications, as well as online and in-classroom training; and support services. Palo Alto Networks, Inc. sells its products and services through its channel partners, as well as directly to medium to large enterprises, service providers, and government entities operating in various industries, including education, energy, financial services, government entities, healthcare, Internet and media, manufacturing, public sector, and telecommunications. The company was incorporated in 2005 and is headquartered in Santa Clara, California.",Santa Clara,United States,Software—Infrastructure,-0.013710001,-0.095010005,0.69626,1675100032.0,0.295,-0.06073,-66600000.0,2981200000.0,577.02,,0.657,-0.01854,3358.489,-0.79906,3340300032.0,3956300032.0,4857500160.0,0.58,"Palo Alto Networks, Inc.",1.196,1686817.0,2167555.0,598.96,577.02,56827469824.0
ABMD,Healthcare,1725.0,"Abiomed, Inc. engages in the research, development, and sale of medical devices to assist or replace the pumping function of the failing heart. It also provides a continuum of care to heart failure patients. The company offers Impella 2.5, a percutaneous micro heart pump with integrated motor and sensors; and Impella CP, a device for use by interventional cardiologists to support patients in the cath lab, as well as by cardiac surgeons in the heart surgery suite. It also provides Impella 5.0, Impella LD, and Impella 5.5, which are percutaneous micro heart pumps with integrated motors and sensors for use primarily in the heart surgery suite; Impella RP, a percutaneous catheter-based axial flow pump; Impella SmartAssist platform that includes optical sensor technology for improved pump positioning and the use of algorithms that enable improved native heart assessment during the weaning process; Impella Connect, a cloud-based technology that enables secure and remote viewing of the Automated Impella Controller for physicians and hospital staffs; and OXY-1 System, a portable external respiratory assistance device. In addition, the company is developing Impella ECP, a pump for blood flow of greater than three liters per minute; Impella XR Sheath, a sheath that expands and recoils allowing small bore access and closure with Impella heart pumps; and Impella BTR, a percutaneous micro heart pump with integrated motors and sensors. Abiomed, Inc. sells its products through direct sales and clinical support personnel in the United States, Japan, Europe, Canada, Latin America, the Asia-Pacific, and the Middle East. The company was founded in 1981 and is headquartered in Danvers, Massachusetts.",Danvers,United States,Medical Devices,0.27996,0.13262,0.81779,292892992.0,0.127,0.25316998,280839008.0,685615000.0,304.33,-0.259,6.98,0.10507,0.779,0.09875,669220992.0,11165000.0,1003148032.0,5.979,"Abiomed, Inc.",31.482,383141.0,428022.0,379.3,304.33,13851944960.0
ADBE,Technology,25988.0,"Adobe Inc. operates as a diversified software company worldwide. It operates through three segments: Digital Media, Digital Experience, and Publishing and Advertising. The Digital Media segment offers products, services, and solutions that enable individuals, teams, and enterprises to create, publish, and promote content; and Document Cloud, a unified cloud-based document services platform. Its flagship product is Creative Cloud, a subscription service that allows members to access its creative products. This segment serves content creators, workers, marketers, educators, enthusiasts, communicators, and consumers. The Digital Experience segment provides an integrated platform and set of applications and services that enable brands and businesses to create, manage, execute, measure, monetize, and optimize customer experiences from analytics to commerce. This segment serves marketers, advertisers, agencies, publishers, merchandisers, merchants, web analysts, data scientists, developers, and executives across the C-suite. The Publishing and Advertising segment offers products and services, such as e-learning solutions, technical document publishing, web conferencing, document and forms platform, web application development, and high-end printing, as well as Advertising Cloud offerings. The company offers its products and services directly to enterprise customers through its sales force and local field offices, as well as to end users through app stores and through its website at adobe.com. It also distributes products and services through a network of distributors, value-added resellers, systems integrators, software vendors and developers, retailers, and original equipment manufacturers. The company was formerly known as Adobe Systems Incorporated and changed its name to Adobe Inc. in October 2018. Adobe Inc. was founded in 1982 and is headquartered in San Jose, California.",San Jose,United States,Software—Infrastructure,0.40405,0.30548,0.88185,7230000128.0,0.2,0.36756,6377999872.0,13920000000.0,453.33,-0.447,1.251,0.14076,31.581,0.34368,5798000128.0,4672999936.0,15784999936.0,1.107,Adobe Inc.,31.152,3682629.0,5838834.0,699.54,453.33,214130868224.0
AMD,Technology,15500.0,"Advanced Micro Devices, Inc. operates as a semiconductor company worldwide. The company operates in two segments, Computing and Graphics; and Enterprise, Embedded and Semi-Custom. Its products include x86 microprocessors as an accelerated processing unit, chipsets, discrete and integrated graphics processing units (GPUs), data center and professional GPUs, and development services; and server and embedded processors, and semi-custom System-on-Chip (SoC) products, development services, and technology for game consoles. The company provides processors for desktop and notebook personal computers under the AMD Ryzen, AMD Ryzen PRO, Ryzen Threadripper, Ryzen Threadripper PRO, AMD Athlon, AMD Athlon PRO, AMD FX, AMD A-Series, and AMD PRO A-Series processors brands; discrete GPUs for desktop and notebook PCs under the AMD Radeon graphics, AMD Embedded Radeon graphics brands; and professional graphics products under the AMD Radeon Pro and AMD FirePro graphics brands. It also offers Radeon Instinct, Radeon PRO V-series, and AMD Instinct accelerators for servers; chipsets under the AMD trademark; microprocessors for servers under the AMD EPYC; embedded processor solutions under the AMD Athlon, AMD Geode, AMD Ryzen, AMD EPYC, AMD R-Series, and G-Series processors brands; and customer-specific solutions based on AMD CPU, GPU, and multi-media technologies, as well as semi-custom SoC products. It serves original equipment manufacturers, public cloud service providers, original design manufacturers, system integrators, independent distributors, online retailers, and add-in-board manufacturers through its direct sales force, independent distributors, and sales representatives. The company was incorporated in 1969 and is headquartered in Santa Clara, California.",Santa Clara,United States,Semiconductors,0.24674,0.19240999,0.48248002,3520999936.0,0.488,0.22198,4055000064.0,7929000000.0,113.46,-0.454,2.024,0.21327,9.764,0.47428,3608000000.0,732000000.0,16433999872.0,1.49,"Advanced Micro Devices, Inc.",6.211,95086364.0,96400643.0,164.46,113.46,184640258048.0
AKAM,Technology,8411.0,"Akamai Technologies, Inc. provides cloud services for securing, delivering, and optimizing content and business applications over the internet in the United States and internationally. The company offers cloud and enterprise security solutions to keep infrastructure, websites, applications, application programming interfaces, and users safe from various cyberattacks and online threats while enhancing performance. It also provides web and mobile performance solutions to enable dynamic websites and applications; media delivery solutions, including video streaming and video player services, game and software delivery, broadcast operations, authoritative domain name system, resolution, and data and analytics; and edge compute solutions to enable developers to deploy and distribute code at the edge. In addition, the company offers carrier offerings, including cyberthreat protection, parental controls, DNS infrastructure and content delivery solutions; and an array of service and support to assist customers with integrating, configuring, optimizing, and managing its offerings. It sells its solutions through direct sales and service organizations, as well as through various channel partners. Akamai Technologies, Inc. has a strategic partnership with Queue-It to deliver a cure for Covid vaccine registration. The company was founded in 1998 and is headquartered in Cambridge, Massachusetts.",Cambridge,United States,Software—Infrastructure,0.33330002,0.17767,0.63335,1308755968.0,0.085,0.22331,1133944064.0,2065477000.0,117.62,0.137,3.776,0.060760003,62.094,0.13912,1917284992.0,2845411072.0,3402151936.0,3.524,"Akamai Technologies, Inc.",28.213,1586703.0,4019490.0,120.68,117.62,19110897664.0
ALGN,Healthcare,,"Align Technology, Inc., a medical device company, designs, manufactures, and markets Invisalign clear aligners and iTero intraoral scanners and services for orthodontists and general practitioner dentists, and restorative and aesthetic dentistry. It operates in two segments, Clear Aligner; and Scanners and Services. The Clear Aligner segment consists of comprehensive products, including Invisalign comprehensive treatment that addresses the orthodontic needs of teenage patients, such as mandibular advancement, compliance indicators, and compensation for tooth eruption; and Invisalign First Phase I and Invisalign First Comprehensive Phase 2 package for younger patients generally between the ages of seven and ten years, which is a mixture of primary/baby and permanent teeth. This segment's non-comprehensive products comprise Invisalign moderate, lite and express packages, and Invisalign go; and non-case products include retention products, Invisalign training fees, and sales of ancillary products, such as cleaning material, and adjusting tools used by dental professionals during the course of treatment. The Scanners and Services segment offers iTero scanner, a single hardware platform with software options for restorative or orthodontic procedures; restorative software for general practitioner dentists, prosthodontists, periodontists, and oral surgeons; and software for orthodontists for digital records storage, orthodontic diagnosis, and for the fabrication of printed models and retainers. This segment also provides computer-aided design and computer-aided manufacturing services; ancillary products, such as disposable sleeves for the wand; iTero model and dies; third party scanners and digital scans; Invisalign outcome simulator, a chair-side and cloud-based application for the iTero scanner; Invisalign progress assessment tool; and TimeLapse technology, which allows doctors or practitioners to compare a patient's historic 3D scans to the present-day scan. The company sells its products in the United States, Switzerland, China, and internationally. Align Technology, Inc. was incorporated in 1997 and is headquartered in Tempe, Arizona.",Tempe,United States,Medical Devices,0.27372,0.19532,0.74264,1172544000.0,0.236,0.24702999,1081921280.0,2935355000.0,442.87,0.205,1.296,0.11331,2.834,0.22518998,1171341952.0,102656000.0,3952583936.0,1.075,"Align Technology, Inc.",44.6,878517.0,1066624.0,737.45,442.87,34921672704.0
LNT,Utilities,3313.0,"Alliant Energy Corporation operates as a utility holding company that provides regulated electricity and natural gas services. It operates through three segments: Utility Electric Operations, Utility Gas Operations, and Utility Other. The company, through its subsidiary, Interstate Power and Light Company (IPL), primarily generates and distributes electricity, and distributes and transports natural gas to retail customers in Iowa; sells electricity to wholesale customers in Minnesota, Illinois, and Iowa; and generates and distributes steam in Cedar Rapids, Iowa. Alliant Energy Corporation, through its other subsidiary, Wisconsin Power and Light Company (WPL), generates and distributes electricity, and distributes and transports natural gas to retail customers in Wisconsin; and sells electricity to wholesale customers in Wisconsin. As of December 31, 2021, IPL supplied electric and natural gas service to approximately 500,000 and 225,000 retail customers respectively; and WPL supplied electric and natural gas service to approximately 485,000 and 200,000 retail customers, respectively. It serves retail customers in the farming, agriculture, industrial manufacturing, chemical, and packaging and food industries. In addition, the company owns and operates a short-line rail freight service in Iowa; a barge, rail, and truck freight terminal on the Mississippi River; and a rail-served warehouse in Iowa, as well as offers freight brokerage services. Further, it holds interests in a 347 megawatt (MW) natural gas-fired electric generating unit near Sheboygan Falls, Wisconsin; and a 225 MW wind farm located in Oklahoma. The company was incorporated in 1981 and is headquartered in Madison, Wisconsin.",Madison,United States,Utilities—Regulated Electric,0.39330003,0.17961,0.42409,582000000.0,0.135,0.21423,1443000064.0,1556000000.0,60.31,0.381,0.52,0.027090002,132.037,0.11096,39000000.0,7909000192.0,3668999936.0,0.233,Alliant Energy Corporation,23.905,1069348.0,1026339.0,62.35,60.31,15099272192.0
GOOG,Communication Services,150028.0,"Larry Page and Sergey Brin founded Google in September 1998. Since then, the company has grown to more than 130,000 employees worldwide, with a wide range of popular products and platforms like Search, Maps, Ads, Gmail, Android, Chrome, Google Cloud and YouTube. In October 2015, Alphabet became the parent holding company of Google.",Mountain View,United States,Internet Content & Information,0.35616,0.29521,0.56511,89395003392.0,0.41,0.303,85196996608.0,97795000000.0,2736.03,0.707,2.98,0.14011,11.493,0.30872,142002995200.0,28109000704.0,239210004480.0,2.862,Alphabet Inc.,367.946,1542080.0,2283371.0,3042.0,2736.03,1815966121984.0
AMZN,Consumer Cyclical,1468000.0,"Amazon.com, Inc. engages in the retail sale of consumer products and subscriptions in North America and internationally. The company operates through three segments: North America, International, and Amazon Web Services (AWS). It sells merchandise and content purchased for resale from third-party sellers through physical and online stores. The company also manufactures and sells electronic devices, including Kindle, Fire tablets, Fire TVs, Rings, and Echo and other devices; provides Kindle Direct Publishing, an online service that allows independent authors and publishers to make their books available in the Kindle Store; and develops and produces media content. In addition, it offers programs that enable sellers to sell their products on its websites, as well as its stores; and programs that allow authors, musicians, filmmakers, skill and app developers, and others to publish and sell content. Further, the company provides compute, storage, database, analytics, machine learning, and other services, as well as fulfillment, advertising, publishing, and digital content subscriptions. Additionally, it offers Amazon Prime, a membership program, which provides free shipping of various items; access to streaming of movies and TV episodes; and other services. The company serves consumers, sellers, developers, enterprises, and content creators. Amazon.com, Inc. was founded in 1994 and is headquartered in Seattle, Washington.",Seattle,United States,Internet Retail,0.1319,0.057350002,0.41307,54671998976.0,0.153,0.06178,60403998720.0,152757000000.0,3225.01,-0.505,1.117,0.05321,113.001,0.25832,78988001280.0,136237998080.0,457965010944.0,0.866,"Amazon.com, Inc.",237.799,3828743.0,5148138.0,3773.08,3225.01,1635557441536.0
AMGN,Healthcare,24300.0,"Amgen Inc. discovers, develops, manufactures, and delivers human therapeutics worldwide. It focuses on inflammation, oncology/hematology, bone health, cardiovascular disease, nephrology, and neuroscience areas. The company's products include Enbrel to treat plaque psoriasis, rheumatoid arthritis, and psoriatic arthritis; Neulasta that reduces the chance of infection due a low white blood cell count in patients cancer; Prolia to treat postmenopausal women with osteoporosis; Xgeva for skeletal-related events prevention; Otezla for the treatment of adult patients with plaque psoriasis, psoriatic arthritis, and oral ulcers associated with BehÃ§et's disease; Aranesp to treat a lower-than-normal number of red blood cells and anemia; KYPROLIS to treat patients with relapsed or refractory multiple myeloma; and Repatha, which reduces the risks of myocardial infarction, stroke, and coronary revascularization. It also markets Nplate, Vectibix, MVASI, Parsabiv, EPOGEN, KANJINTI, BLINCYTO, Aimovig, EVENITY, AMGEVITATM, Sensipar/Mimpara, NEUPOGEN, IMLYGIC, Corlanor, and AVSOLA. Amgen Inc. serves healthcare providers, including physicians or their clinics, dialysis centers, hospitals, and pharmacies. It distributes its products through pharmaceutical wholesale distributors, as well as direct-to-consumer channels. The company has collaboration agreements with Novartis Pharma AG; UCB; Bayer HealthCare LLC; BeiGene, Ltd.; Eli Lilly and Company; Datos Health; and Verastem, Inc. to evaluate VS-6766 in combination with lumakrastm (Sotorasib) in patients with KRAS G12C-mutant non-small cell lung cancer. It has an agreement with Kyowa Kirin Co., Ltd. to jointly develop and commercialize KHK4083, a Phase 3-ready anti-OX40 fully human monoclonal antibody for the treatment of atopic dermatitis and other autoimmune diseases; and a strategic research and development collaboration with Neumora Therapeutics, Inc. Amgen Inc. was founded in 1980 and is headquartered in Thousand Oaks, California.",Thousand Oaks,United States,Drug Manufacturers—General,0.47642,0.21767999,0.75421995,8606000128.0,0.044,0.34998,12275999744.0,19265000000.0,236.25,-0.035,1.643,0.08696,457.332,0.585,12920999936.0,37579001856.0,25767000064.0,1.192,Amgen Inc.,14.543,3146124.0,7617112.0,261.0,236.25,133071585280.0
ADI,Technology,24700.0,"Analog Devices, Inc. designs, manufactures, tests, and markets integrated circuits (ICs), software, and subsystems that leverage analog, mixed-signal, and digital signal processing technologies. The company provides data converter products, which translate real-world analog signals into digital data, as well as translates digital data into analog signals; power management and reference products for power conversion, driver monitoring, sequencing, and energy management applications in the automotive, communications, industrial, and high-end consumer markets; and power ICs include performance, integration, and software design simulation tools for accurate power supply designs. It also offers high-performance amplifiers to condition analog signals; and radio frequency and microwave ICs to support cellular infrastructure; and microelectromechanical systems technology solutions, including accelerometers used to sense acceleration, gyroscopes for sense rotation, inertial measurement units to sense multiple degrees of freedom, and broadband switches for radio and instrument systems, as well as isolators. In addition, the company offers digital signal processing and system products for high-speed numeric calculations. It serves clients in the industrial, automotive, consumer, instrumentation, aerospace, and communications markets through a direct sales force, third-party distributors, and independent sales representatives in the United States, the rest of North and South America, Europe, Japan, China, and rest of Asia, as well as through its Website. Analog Devices, Inc. was incorporated in 1965 and is headquartered in Wilmington, Massachusetts.",Wilmington,United States,Semiconductors,0.38916,0.18999,0.61831003,2735068928.0,0.533,0.24232,2848005888.0,4525012000.0,163.45,-0.855,1.941,0.03004,18.736,0.055630002,1977964032.0,7118233088.0,7318285824.0,1.241,"Analog Devices, Inc.",72.321,3909732.0,9901871.0,191.95,163.45,85865349120.0
